{
  "$schema": "https://json-schema.org/draft/2020-12/schema",
  "$id": "urn:agent-evals-standard:schema:enforcement-receipt:1",
  "title": "Detached enforcement receipt",
  "type": "object",
  "required": ["schemaVersion", "id", "sourceEventId", "sourceEventDigest", "affectedScope", "requestedAt", "startedAt", "completedAt", "outcome", "executor", "evidence", "verifier", "digest", "signature"],
  "properties": {
    "schemaVersion": { "const": "agent-eval-enforcement-receipt-1" },
    "id": { "$ref": "#/$defs/id" },
    "sourceEventId": { "$ref": "#/$defs/id" },
    "sourceEventDigest": { "$ref": "#/$defs/digest" },
    "affectedScope": { "type": "object", "required": ["scopeDigest", "riskTier", "claimIds"], "properties": { "scopeDigest": { "$ref": "#/$defs/digest" }, "riskTier": { "enum": ["low", "medium", "high", "critical"] }, "decisionId": { "$ref": "#/$defs/id" }, "scorecardId": { "$ref": "#/$defs/id" }, "claimIds": { "type": "array", "items": { "$ref": "#/$defs/id" }, "uniqueItems": true } }, "additionalProperties": false },
    "stopAction": { "$ref": "urn:agent-evals-standard:schema:escalation-event-registry:1#/$defs/stopAction" },
    "scopeAction": { "$ref": "urn:agent-evals-standard:schema:escalation-event-registry:1#/$defs/scopeAction" },
    "resumeAction": { "const": "resume_approved_scope" },
    "sourceResolutionId": { "$ref": "#/$defs/id" },
    "sourceResolutionDigest": { "$ref": "#/$defs/digest" },
    "resumeConditionResults": {
      "type": "array", "minItems": 1,
      "items": {
        "type": "object", "required": ["condition", "status", "evidenceIds"],
        "properties": {
          "condition": { "type": "string", "minLength": 1 },
          "status": { "const": "pass" },
          "evidenceIds": { "type": "array", "minItems": 1, "items": { "$ref": "#/$defs/id" }, "uniqueItems": true }
        },
        "additionalProperties": false
      }
    },
    "requestedAt": { "type": "string", "format": "date-time", "pattern": "Z$" },
    "startedAt": { "type": "string", "format": "date-time", "pattern": "Z$" },
    "completedAt": { "type": "string", "format": "date-time", "pattern": "Z$" },
    "outcome": { "const": "applied" },
    "executor": { "type": "object", "required": ["id", "role", "authorizationEvidenceId"], "properties": { "id": { "$ref": "#/$defs/id" }, "role": { "type": "string", "minLength": 1 }, "authorizationEvidenceId": { "$ref": "#/$defs/id" } }, "additionalProperties": false },
    "evidence": { "type": "array", "minItems": 1, "items": { "$ref": "#/$defs/id" }, "uniqueItems": true },
    "verifier": { "type": "object", "required": ["id", "version", "digest"], "properties": { "id": { "$ref": "#/$defs/id" }, "version": { "type": "string", "minLength": 1 }, "digest": { "$ref": "#/$defs/digest" } }, "additionalProperties": false },
    "digest": { "$ref": "#/$defs/digest" },
    "signature": { "$ref": "urn:agent-evals-standard:schema:signature-profile:1#/$defs/signature" }
  },
  "oneOf": [
    {
      "required": ["stopAction", "scopeAction"],
      "properties": {
        "stopAction": {}, "scopeAction": {}, "resumeAction": false,
        "sourceResolutionId": false, "sourceResolutionDigest": false,
        "resumeConditionResults": false
      }
    },
    {
      "required": ["resumeAction", "sourceResolutionId", "sourceResolutionDigest", "resumeConditionResults"],
      "properties": {
        "resumeAction": {}, "sourceResolutionId": {}, "sourceResolutionDigest": {},
        "resumeConditionResults": {}, "stopAction": false, "scopeAction": false
      }
    }
  ],
  "additionalProperties": false,
  "$defs": {
    "id": { "type": "string", "pattern": "^[A-Za-z0-9][A-Za-z0-9_.:-]*$" },
    "digest": { "type": "string", "pattern": "^sha256:[a-f0-9]{64}$" }
  }
}
