{
  "schemaVersion": "agent-eval-enforcement-receipt-1",
  "id": "enforcement-receipt-fixture-1",
  "sourceEventId": "escalation-fixture-1",
  "sourceEventDigest": "sha256:278ce9050dab964cf130a91fb917ab36e86c15b0dfc0c98f773c5e6b8632e6a1",
  "affectedScope": {
    "scopeDigest": "sha256:b59491fd25d11e97fbad312086031faf0bc48aecb17ba897800aaf344d27d602",
    "riskTier": "high",
    "decisionId": "decision-fixture-1",
    "scorecardId": "scorecard-fixture-1",
    "claimIds": [
      "claim-fixture-1"
    ]
  },
  "stopAction": "stop_governance_use",
  "scopeAction": "revoke_affected_scope",
  "requestedAt": "2026-08-01T00:00:13Z",
  "startedAt": "2026-08-01T00:00:15Z",
  "completedAt": "2026-08-01T00:00:16Z",
  "outcome": "applied",
  "executor": {
    "id": "fixture-enforcement-executor",
    "role": "policy_enforcer",
    "authorizationEvidenceId": "fixture-executor-authorization-1"
  },
  "evidence": [
    "enforcement-log-fixture-1"
  ],
  "verifier": {
    "id": "fixture-enforcement-verifier",
    "version": "0.1.0",
    "digest": "sha256:f6c831a7dc917e6748d5396a79f2906d4214857d9af130e7bddd291d653ecd13"
  },
  "digest": "sha256:933be16499a65e0eab7f4765d28b42b813c8cb241da84217dbe118dc92d23454",
  "signature": {
    "profileId": "fixture-signature-profile",
    "algorithm": "Ed25519",
    "keyId": "rfc8032-test-key-1",
    "signedAt": "2026-08-01T00:00:17Z",
    "value": "pUn1u0JxqG_A8IuLIeXxpFYCrloXTralKH8zY7FVqOWu8dtpdMSrKia5ZBHfXUbtFhpPTNCCCoiruu5isFHRBw"
  }
}
